[{"id": "W3094472893", "categories": [], "study_design": "not_applicable", "genre": "other", "about_ca_system": false, "about_ca_topic": false, "confidence": "low", "reason": "Judged on title alone; does not fit any defined category."}, {"id": "W3095043942", "categories": ["metaresearch"], "domain": "evaluation", "study_design": "qualitative", "genre": "empirical", "about_ca_system": false, "about_ca_topic": false, "confidence": "high", "reason": "Evaluates the impact of a research partnership (Students-as-Partners), fitting the 'evaluation' domain of metaresearch."}, {"id": "W3096391099", "categories": [], "study_design": "observational", "genre": "empirical", "about_ca_system": false, "about_ca_topic": false, "confidence": "high", "reason": "Empirical study on cattle genetics; not a study of research practices."}, {"id": "W3096487142", "categories": ["metaresearch"], "domain": "evaluation", "study_design": "qualitative", "genre": "empirical", "about_ca_system": false, "about_ca_topic": false, "confidence": "high", "reason": "Analyzes the implementation and impact of a research-partnership initiative in a curriculum."}, {"id": "W3104993560", "categories": [], "study_design": "observational", "genre": "empirical", "about_ca_system": false, "about_ca_topic": false, "confidence": "high", "reason": "Review of mobile apps for gambling treatment; the object is the app/treatment, not the research process."}, {"id": "W3105492687", "categories": ["metaresearch"], "domain": "methods", "study_design": "systematic_review", "genre": "review", "about_ca_system": false, "about_ca_topic": false, "confidence": "high", "reason": "Evaluates the 'Theory of Change' as a methodological approach in evaluation literature."}, {"id": "W3108842605", "categories": [], "study_design": "simulation_or_modeling", "genre": "methods", "about_ca_system": false, "about_ca_topic": false, "confidence": "high", "reason": "Developing a statistical technique for a domain; RULE 1 excludes this from metaresearch."}, {"id": "W3111280279", "categories": [], "study_design": "observational", "genre": "empirical", "about_ca_system": false, "about_ca_topic": false, "confidence": "high", "reason": "Study on tax impacts of influencer marketing; not a study of research practices."}, {"id": "W3112500270", "categories": [], "study_design": "theoretical_or_conceptual", "genre": "other", "about_ca_system": false, "about_ca_topic": false, "confidence": "low", "reason": "Judged on title alone; economic theory paper."}, {"id": "W3114240958", "categories": [], "study_design": "not_applicable", "genre": "other", "about_ca_system": false, "about_ca_topic": false, "confidence": "high", "reason": "Technical guide on mechanical fasteners; not a study of research practices."}, {"id": "W3115852333", "categories": [], "study_design": "bench_or_experimental", "genre": "empirical", "about_ca_system": false, "about_ca_topic": false, "confidence": "high", "reason": "Experimental study on human arm movements; not a study of research practices."}, {"id": "W3116112122", "categories": [], "study_design": "meta_analysis", "genre": "review", "about_ca_system": false, "about_ca_topic": false, "confidence": "high", "reason": "Systematic review of SES and oral health; the unit of analysis is the patient/person, not the study."}, {"id": "W3119252148", "categories": ["scholarly_communication"], "study_design": "not_applicable", "genre": "empirical", "about_ca_system": false, "about_ca_topic": false, "confidence": "low", "reason": "Judged on title; concerns dissertation formats, which falls under scholarly communication."}, {"id": "W3121186031", "categories": [], "study_design": "not_applicable", "genre": "editorial", "about_ca_system": false, "about_ca_topic": false, "confidence": "high", "reason": "Corrigendum to a paper on Latin-square designs; not a study of research practices."}, {"id": "W3121385036", "categories": [], "study_design": "not_applicable", "genre": "other", "about_ca_system": false, "about_ca_topic": false, "confidence": "low", "reason": "Judged on title alone; economic geography paper."}, {"id": "W3122474220", "categories": [], "study_design": "theoretical_or_conceptual", "genre": "methods", "about_ca_system": false, "about_ca_topic": false, "confidence": "low", "reason": "Judged on title; mathematical function analysis."}, {"id": "W3122679125", "categories": ["sts"], "study_design": "not_applicable", "genre": "other", "about_ca_system": false, "about_ca_topic": false, "confidence": "low", "reason": "Judged on title; studies the interface of scientific advice and public policy (co-production)."}, {"id": "W3122958054", "categories": [], "study_design": "not_applicable", "genre": "methods", "about_ca_system": false, "about_ca_topic": false, "confidence": "low", "reason": "Judged on title; a guide to a statistical technique (Regression Discontinuity), excluded by RULE 1."}, {"id": "W3123106997", "categories": [], "study_design": "not_applicable", "genre": "other", "about_ca_system": false, "about_ca_topic": false, "confidence": "low", "reason": "Judged on title; regulatory regime analysis in finance."}, {"id": "W3125200970", "categories": [], "study_design": "theoretical_or_conceptual", "genre": "other", "about_ca_system": false, "about_ca_topic": false, "confidence": "low", "reason": "Judged on title; economic theory on constitutions/coalitions."}, {"id": "W3130340903", "categories": ["open_science"], "study_design": "not_applicable", "genre": "other", "about_ca_system": false, "about_ca_topic": false, "confidence": "low", "reason": "Judged on title; #Blackbotanistsweek relates to inclusivity and equity in knowledge production."}, {"id": "W3134339722", "categories": ["metaresearch"], "domain": "methods", "study_design": "theoretical_or_conceptual", "genre": "methods", "about_ca_system": false, "about_ca_topic": false, "confidence": "high", "reason": "Discusses implementation science and knowledge translation to reduce research-practice gaps."}, {"id": "W3137000688", "categories": ["metaresearch"], "domain": "evaluation", "study_design": "not_applicable", "genre": "methods", "about_ca_system": false, "about_ca_topic": false, "confidence": "high", "reason": "Proposes collaborative evaluation designs as a way to measure learning in evaluator education."}, {"id": "W3138386593", "categories": ["metaresearch"], "domain": "evaluation", "study_design": "not_applicable", "genre": "commentary", "about_ca_system": false, "about_ca_topic": false, "confidence": "high", "reason": "Discusses opportunities to strengthen health research systems."}, {"id": "W3138688726", "categories": ["metaresearch"], "domain": "evaluation", "study_design": "qualitative", "genre": "empirical", "about_ca_system": false, "about_ca_topic": false, "confidence": "high", "reason": "Reflective analysis on the design and outcomes of an introductory evaluation course."}]