[{"id": "W7116650886", "categories": [], "domain": null, "study_design": "design_other", "genre": "empirical", "about_ca_system": false, "about_ca_topic": false, "confidence": "medium", "reason": "The work studies higher-education quality assurance, not research practices or the Canadian research system."}, {"id": "W2499069400", "categories": ["insufficient_payload"], "domain": null, "study_design": "not_applicable", "genre": "other", "about_ca_system": false, "about_ca_topic": false, "confidence": "high", "reason": "The abstract is a bibliographic citation and truncated database record rather than a screenable abstract."}, {"id": "W4403430032", "categories": ["metaresearch"], "domain": "methods", "study_design": "qualitative", "genre": "empirical", "about_ca_system": false, "about_ca_topic": false, "confidence": "high", "reason": "The work examines how a collaborative research practice was used and shaped the project's process and outputs."}, {"id": "W7133057119", "categories": [], "domain": null, "study_design": "qualitative", "genre": "empirical", "about_ca_system": false, "about_ca_topic": false, "confidence": "medium", "reason": "The title identifies a qualitative multiple-case education study, not a defined MetaCan category."}, {"id": "W2997409239", "categories": ["insufficient_payload"], "domain": null, "study_design": "not_applicable", "genre": "other", "about_ca_system": false, "about_ca_topic": false, "confidence": "high", "reason": "The abstract is a database citation and boilerplate chapter record rather than a screenable abstract."}, {"id": "W2938572552", "categories": ["insufficient_payload"], "domain": null, "study_design": "systematic_review", "genre": "review", "about_ca_system": false, "about_ca_topic": false, "confidence": "high", "reason": "The abstract field is a database citation with embedded bibliographic boilerplate, so the payload is not a clean screenable record."}, {"id": "W3206922079", "categories": [], "domain": null, "study_design": "not_applicable", "genre": "commentary", "about_ca_system": false, "about_ca_topic": false, "confidence": "high", "reason": "The work reflects on classroom teaching practice rather than research practice or science as a social practice."}, {"id": "W2571097605", "categories": [], "domain": null, "study_design": "design_other", "genre": "empirical", "about_ca_system": false, "about_ca_topic": false, "confidence": "low", "reason": "The title describes pooled clinical trial results, not a defined MetaCan category."}, {"id": "W7133022389", "categories": [], "domain": null, "study_design": "design_other", "genre": "empirical", "about_ca_system": false, "about_ca_topic": false, "confidence": "low", "reason": "The title concerns healthcare quality-improvement implementation, not research practices as an object of study."}, {"id": "W2005609788", "categories": [], "domain": null, "study_design": "theoretical_or_conceptual", "genre": "review", "about_ca_system": false, "about_ca_topic": false, "confidence": "high", "reason": "The review concerns human evolution and fossil evidence, not science or research as a social practice."}, {"id": "W2408418438", "categories": [], "domain": null, "study_design": "theoretical_or_conceptual", "genre": "methods", "about_ca_system": false, "about_ca_topic": false, "confidence": "low", "reason": "The title describes development of a technical graphical-model method, which Rule 1 excludes from metaresearch."}, {"id": "W1984548986", "categories": ["metaresearch", "research_integrity"], "domain": "methods", "study_design": "not_applicable", "genre": "commentary", "about_ca_system": false, "about_ca_topic": false, "confidence": "high", "reason": "The work addresses scientific integrity and alleged research-related fraud as objects of discussion."}, {"id": "W1521457387", "categories": [], "domain": null, "study_design": "observational", "genre": "empirical", "about_ca_system": false, "about_ca_topic": false, "confidence": "high", "reason": "The work studies multinational production networks, not research, science, or scholarly communication."}, {"id": "W2090052224", "categories": [], "domain": null, "study_design": "theoretical_or_conceptual", "genre": "commentary", "about_ca_system": false, "about_ca_topic": false, "confidence": "low", "reason": "The title concerns legal, scientific, and medical-ethics intersections without establishing a defined MetaCan object."}, {"id": "W4376654146", "categories": [], "domain": null, "study_design": "theoretical_or_conceptual", "genre": "methods", "about_ca_system": false, "about_ca_topic": false, "confidence": "low", "reason": "The work develops a treatment-comparison method rather than studying methods as used or reported by researchers."}, {"id": "W3087474231", "categories": [], "domain": null, "study_design": "bench_or_experimental", "genre": "methods", "about_ca_system": false, "about_ca_topic": false, "confidence": "low", "reason": "The work applies an experimental microscopy technique to vaccine carriers, which Rule 1 excludes."}, {"id": "W2616845762", "categories": [], "domain": null, "study_design": "qualitative", "genre": "empirical", "about_ca_system": false, "about_ca_topic": false, "confidence": "high", "reason": "The work studies collaborative program evaluation practice, not evaluation of research practices or research assessment."}, {"id": "W6902090556", "categories": ["insufficient_payload"], "domain": null, "study_design": "not_applicable", "genre": "dataset", "about_ca_system": false, "about_ca_topic": false, "confidence": "high", "reason": "The record is labeled as an additional supplementary file and provides no screenable abstract."}, {"id": "W4366451145", "categories": [], "domain": null, "study_design": "not_applicable", "genre": "editorial", "about_ca_system": false, "about_ca_topic": false, "confidence": "high", "reason": "The title unambiguously identifies an editorial item without a defined MetaCan object."}, {"id": "W4387092983", "categories": [], "domain": null, "study_design": "not_applicable", "genre": "commentary", "about_ca_system": false, "about_ca_topic": false, "confidence": "high", "reason": "The response discusses academic identity and curriculum rather than a defined MetaCan category."}, {"id": "W793070171", "categories": [], "domain": null, "study_design": "not_applicable", "genre": "commentary", "about_ca_system": false, "about_ca_topic": false, "confidence": "low", "reason": "The title alone does not establish that the work studies research practices, science, or scholarly communication."}, {"id": "W6939789930", "categories": ["insufficient_payload"], "domain": null, "study_design": "not_applicable", "genre": "dataset", "about_ca_system": false, "about_ca_topic": false, "confidence": "high", "reason": "The record is labeled as an additional supplementary file and provides no screenable abstract."}, {"id": "W2029499565", "categories": [], "domain": null, "study_design": "theoretical_or_conceptual", "genre": "methods", "about_ca_system": false, "about_ca_topic": false, "confidence": "low", "reason": "The work develops a mathematical estimator rather than studying research methods as a research object."}, {"id": "W4384704291", "categories": [], "domain": null, "study_design": "not_applicable", "genre": "editorial", "about_ca_system": false, "about_ca_topic": false, "confidence": "high", "reason": "The title unambiguously identifies an editorial item without a defined MetaCan object."}, {"id": "W3122958054", "categories": [], "domain": null, "study_design": "theoretical_or_conceptual", "genre": "methods", "about_ca_system": false, "about_ca_topic": false, "confidence": "low", "reason": "The work is a guide to a statistical design technique, which Rule 1 excludes from metaresearch."}]