[{"id": "W4210789668", "categories": [], "domain": null, "study_design": "systematic_review", "genre": "review", "about_ca_system": false, "about_ca_topic": false, "confidence": "high", "reason": "The review studies hospital big-data capabilities, not research practices or scholarly communication."}, {"id": "W6920491591", "categories": [], "domain": null, "study_design": "systematic_review", "genre": "review", "about_ca_system": false, "about_ca_topic": false, "confidence": "low", "reason": "The title-only record concerns trial consent and community engagement, not a defined rubric category."}, {"id": "W1534032619", "categories": [], "domain": null, "study_design": "not_applicable", "genre": "commentary", "about_ca_system": false, "about_ca_topic": false, "confidence": "high", "reason": "The commentary concerns leadership and evidence use in clinical practice, not research as an object."}, {"id": "W7128515512", "categories": [], "domain": null, "study_design": "design_other", "genre": "empirical", "about_ca_system": false, "about_ca_topic": false, "confidence": "high", "reason": "The study develops and evaluates forecasting models for time series, which is a domain technique rather than metaresearch."}, {"id": "W2951761668", "categories": [], "domain": null, "study_design": "not_applicable", "genre": "commentary", "about_ca_system": false, "about_ca_topic": false, "confidence": "high", "reason": "The article discusses nursing education and recommendations, not research practices as an object."}, {"id": "W3003661931", "categories": [], "domain": null, "study_design": "observational", "genre": "empirical", "about_ca_system": false, "about_ca_topic": false, "confidence": "high", "reason": "The cohort study examines prenatal thyroid problems and adolescent psychiatric outcomes, not a defined category."}, {"id": "W2921815814", "categories": [], "domain": null, "study_design": "not_applicable", "genre": "other", "about_ca_system": false, "about_ca_topic": false, "confidence": "low", "reason": "The title-only record does not establish that science or research is studied as a social practice."}, {"id": "W4416543324", "categories": [], "domain": null, "study_design": "design_other", "genre": "review", "about_ca_system": false, "about_ca_topic": false, "confidence": "high", "reason": "The review concerns prenatal cannabis exposure and mental health, not research practices or scholarly systems."}, {"id": "W6943412651", "categories": [], "domain": null, "study_design": "not_applicable", "genre": "dataset", "about_ca_system": false, "about_ca_topic": false, "confidence": "high", "reason": "This is a biodiversity occurrence dataset and does not study a defined rubric category."}, {"id": "W6921197322", "categories": [], "domain": null, "study_design": "design_other", "genre": "other", "about_ca_system": false, "about_ca_topic": true, "confidence": "low", "reason": "The title identifies Canada as the substantive setting and subject, but the missing abstract prevents more specific screening."}, {"id": "W2781899786", "categories": [], "domain": null, "study_design": "bench_or_experimental", "genre": "empirical", "about_ca_system": false, "about_ca_topic": false, "confidence": "high", "reason": "The experiment applies spectroscopy to grain processing, which is a domain technique rather than metaresearch."}, {"id": "W2569574764", "categories": [], "domain": null, "study_design": "design_other", "genre": "software", "about_ca_system": false, "about_ca_topic": false, "confidence": "high", "reason": "The article describes a property-visualization application, not a defined category."}, {"id": "W7036292878", "categories": [], "domain": null, "study_design": "design_other", "genre": "other", "about_ca_system": false, "about_ca_topic": false, "confidence": "low", "reason": "The title-only record concerns aquifer characterization and does not establish a defined category."}, {"id": "W2799898098", "categories": [], "domain": null, "study_design": "simulation_or_modeling", "genre": "empirical", "about_ca_system": false, "about_ca_topic": false, "confidence": "high", "reason": "The work models heavy-oil pipeline friction losses, which is engineering research rather than research-on-research."}, {"id": "W4315700855", "categories": [], "domain": null, "study_design": "simulation_or_modeling", "genre": "empirical", "about_ca_system": false, "about_ca_topic": false, "confidence": "high", "reason": "The work simulates additive-manufacturing temperatures, which is a domain modeling technique rather than metaresearch."}, {"id": "W2075847578", "categories": ["insufficient_payload"], "domain": null, "study_design": "not_applicable", "genre": "other", "about_ca_system": false, "about_ca_topic": false, "confidence": "high", "reason": "The title is a bibliographic citation artifact and the record cannot be screened as a scholarly work."}, {"id": "W4246615486", "categories": [], "domain": null, "study_design": "observational", "genre": "methods", "about_ca_system": false, "about_ca_topic": false, "confidence": "high", "reason": "The study develops a health metric for population research, and Rule 1 excludes domain techniques from metaresearch."}, {"id": "W1991282154", "categories": [], "domain": null, "study_design": "observational", "genre": "empirical", "about_ca_system": false, "about_ca_topic": false, "confidence": "high", "reason": "The cohort study validates a breastfeeding scale in a clinical population, not research practices as an object."}, {"id": "W4254516102", "categories": [], "domain": null, "study_design": "not_applicable", "genre": "dataset", "about_ca_system": false, "about_ca_topic": false, "confidence": "high", "reason": "This is a mass-spectrometry standards dataset and does not study a defined category."}, {"id": "W2012377092", "categories": [], "domain": null, "study_design": "bench_or_experimental", "genre": "empirical", "about_ca_system": false, "about_ca_topic": false, "confidence": "high", "reason": "The experiment studies lung-cell differentiation and scaffolds, not research practices or scholarly systems."}, {"id": "W2100400824", "categories": [], "domain": null, "study_design": "observational", "genre": "empirical", "about_ca_system": false, "about_ca_topic": false, "confidence": "high", "reason": "The matched observational study examines pregnancy and lupus nephritis, not a defined rubric category."}, {"id": "W2054976157", "categories": [], "domain": null, "study_design": "bench_or_experimental", "genre": "methods", "about_ca_system": false, "about_ca_topic": false, "confidence": "high", "reason": "The work develops a chemical reduction method, which Rule 1 excludes from metaresearch."}, {"id": "W4298415171", "categories": [], "domain": null, "study_design": "not_applicable", "genre": "other", "about_ca_system": false, "about_ca_topic": true, "confidence": "high", "reason": "Canada is the substantive subject of this trade-law work, but the record does not belong to another defined category."}, {"id": "W4399842911", "categories": [], "domain": null, "study_design": "design_other", "genre": "other", "about_ca_system": false, "about_ca_topic": false, "confidence": "low", "reason": "The title-only book chapter concerns nonverbal communication strategies and does not establish a defined category."}, {"id": "W2054666188", "categories": [], "domain": null, "study_design": "bench_or_experimental", "genre": "empirical", "about_ca_system": false, "about_ca_topic": false, "confidence": "high", "reason": "The experiment produces an antibody fragment in tobacco plants, which is domain research rather than research-on-research."}]