[{"id": "W1130873975", "categories": [], "study_design": "observational", "genre": "empirical", "about_ca_system": false, "about_ca_topic": false, "confidence": "low", "reason": "Title describes a biological mouse model study, not research on research."}, {"id": "W1493255413", "categories": ["metaresearch"], "domain": "methods", "study_design": "systematic_review", "genre": "review", "about_ca_system": false, "about_ca_topic": false, "confidence": "high", "reason": "Scoping review evaluating the use of Complex Adaptive Systems perspectives in health promotion evaluations."}, {"id": "W1502775799", "categories": ["sts"], "study_design": "theoretical_or_conceptual", "genre": "empirical", "about_ca_system": false, "about_ca_topic": true, "confidence": "high", "reason": "Studies the production of anthropological knowledge and the decolonization of research practices in Quebec."}, {"id": "W1506351630", "categories": [], "study_design": "observational", "genre": "empirical", "about_ca_system": false, "about_ca_topic": false, "confidence": "low", "reason": "Title suggests a study on student support services, not a study of research practices."}, {"id": "W1506594705", "categories": ["metaresearch"], "domain": "methods", "study_design": "not_applicable", "genre": "empirical", "about_ca_system": false, "about_ca_topic": false, "confidence": "low", "reason": "Focuses on professionalizing evaluation and evaluator competencies."}, {"id": "W1516392200", "categories": [], "study_design": "bench_or_experimental", "genre": "empirical", "about_ca_system": false, "about_ca_topic": false, "confidence": "high", "reason": "Experimental study on rat offspring; not research on research."}, {"id": "W1521457387", "categories": [], "study_design": "observational", "genre": "empirical", "about_ca_system": false, "about_ca_topic": false, "confidence": "high", "reason": "Empirical analysis of multinational production networks in economics."}, {"id": "W1534032619", "categories": ["metaresearch"], "domain": "methods", "study_design": "not_applicable", "genre": "commentary", "about_ca_system": false, "about_ca_topic": false, "confidence": "high", "reason": "Commentary on the use of evidence in nursing practice."}, {"id": "W1545194763", "categories": [], "study_design": "theoretical_or_conceptual", "genre": "empirical", "about_ca_system": false, "about_ca_topic": false, "confidence": "high", "reason": "Economic analysis of public opposition to globalisation."}, {"id": "W1562377822", "categories": ["metaresearch"], "domain": "methods", "study_design": "not_applicable", "genre": "empirical", "about_ca_system": false, "about_ca_topic": false, "confidence": "low", "reason": "Explores social desirability bias, a methodological issue in research conduct."}, {"id": "W1570138353", "categories": ["metaresearch"], "domain": "methods", "study_design": "systematic_review", "genre": "review", "about_ca_system": false, "about_ca_topic": false, "confidence": "high", "reason": "Review of methods for assessing prognostic accuracy in patient outcome prediction."}, {"id": "W1589224727", "categories": [], "study_design": "theoretical_or_conceptual", "genre": "empirical", "about_ca_system": false, "about_ca_topic": false, "confidence": "high", "reason": "Sociological theory paper on Parsons' action theory."}, {"id": "W1594257894", "categories": ["metaresearch", "sts"], "domain": "methods", "study_design": "qualitative", "genre": "empirical", "about_ca_system": false, "about_ca_topic": false, "confidence": "high", "reason": "Develops an Indigenous evaluation framework by synthesizing Indigenous ways of knowing with Western practice."}, {"id": "W1607364779", "categories": [], "study_design": "not_applicable", "genre": "empirical", "about_ca_system": false, "about_ca_topic": false, "confidence": "low", "reason": "Title suggests a study on business ethics, not research practices."}, {"id": "W1608940271", "categories": [], "study_design": "qualitative", "genre": "empirical", "about_ca_system": false, "about_ca_topic": true, "confidence": "high", "reason": "Study on literacy practices of Canadian Aboriginal students."}, {"id": "W1623734131", "categories": [], "study_design": "not_applicable", "genre": "empirical", "about_ca_system": false, "about_ca_topic": false, "confidence": "low", "reason": "Focuses on quality assurance in higher education governance."}, {"id": "W1663638353", "categories": ["metaresearch"], "domain": "methods", "study_design": "not_applicable", "genre": "methods", "about_ca_system": false, "about_ca_topic": false, "confidence": "high", "reason": "A book/work on case study research design and methods."}, {"id": "W1676731399", "categories": [], "study_design": "observational", "genre": "review", "about_ca_system": false, "about_ca_topic": false, "confidence": "high", "reason": "Clinical review of relapses in multiple sclerosis."}, {"id": "W1724770786", "categories": ["metaresearch"], "domain": "methods", "study_design": "qualitative", "genre": "empirical", "about_ca_system": false, "about_ca_topic": false, "confidence": "high", "reason": "Examines the role of reflexivity in the process of evaluation."}, {"id": "W1729984106", "categories": [], "study_design": "observational", "genre": "empirical", "about_ca_system": false, "about_ca_topic": false, "confidence": "high", "reason": "Economic study on willingness-to-pay for healthcare in India."}, {"id": "W1740003218", "categories": [], "study_design": "qualitative", "genre": "empirical", "about_ca_system": false, "about_ca_topic": false, "confidence": "low", "reason": "Study on teacher candidates' test-taking experiences."}, {"id": "W1746398764", "categories": [], "study_design": "review", "genre": "review", "about_ca_system": false, "about_ca_topic": false, "confidence": "low", "reason": "Clinical review of low vision management."}, {"id": "W1746934302", "categories": ["metaresearch"], "domain": "methods", "study_design": "qualitative", "genre": "empirical", "about_ca_system": false, "about_ca_topic": false, "confidence": "high", "reason": "Examines evaluator competencies and the professionalization of the field of evaluation."}, {"id": "W1821441292", "categories": ["metaresearch"], "domain": "methods", "study_design": "meta_analysis", "genre": "review", "about_ca_system": false, "about_ca_topic": false, "confidence": "high", "reason": "Systematic review and meta-analysis of interventions to promote evidence-informed decision-making."}, {"id": "W1868201869", "categories": [], "study_design": "randomized_trial", "genre": "protocol", "about_ca_system": false, "about_ca_topic": false, "confidence": "high", "reason": "Clinical trial protocol for a physical activity intervention."}]