[{"id": "W2408418438", "categories": [], "domain": null, "study_design": "theoretical_or_conceptual", "genre": "methods", "about_ca_system": false, "about_ca_topic": false, "confidence": "low", "reason": "Developing a technique for a domain is OUT per Rule 1."}, {"id": "W2462945271", "categories": [], "domain": null, "study_design": "not_applicable", "genre": "protocol", "about_ca_system": false, "about_ca_topic": false, "confidence": "low", "reason": "Proposal for an educational activity is not a study of research practice."}, {"id": "W2494134454", "categories": [], "domain": null, "study_design": "not_applicable", "genre": "review", "about_ca_system": false, "about_ca_topic": true, "confidence": "low", "reason": "Book review of educational foundations is not metaresearch."}, {"id": "W2499069400", "categories": [], "domain": null, "study_design": "observational", "genre": "empirical", "about_ca_system": false, "about_ca_topic": false, "confidence": "high", "reason": "Clinical outcome study; not a study of research practices."}, {"id": "W2499635074", "categories": [], "domain": null, "study_design": "theoretical_or_conceptual", "genre": "other", "about_ca_system": false, "about_ca_topic": false, "confidence": "low", "reason": "Pedagogy chapter is not a study of research practice."}, {"id": "W2508875552", "categories": [], "domain": null, "study_design": "theoretical_or_conceptual", "genre": "other", "about_ca_system": false, "about_ca_topic": false, "confidence": "low", "reason": "Mathematical axiomatic system is not metaresearch."}, {"id": "W2512166791", "categories": [], "domain": null, "study_design": "qualitative", "genre": "empirical", "about_ca_system": false, "about_ca_topic": false, "confidence": "high", "reason": "Study of peer mentorship in medical education is not metaresearch."}, {"id": "W2514259613", "categories": [], "domain": null, "study_design": "simulation_or_modeling", "genre": "methods", "about_ca_system": false, "about_ca_topic": false, "confidence": "high", "reason": "Developing a statistical residual technique is OUT per Rule 1."}, {"id": "W2530783219", "categories": [], "domain": null, "study_design": "not_applicable", "genre": "review", "about_ca_system": false, "about_ca_topic": false, "confidence": "low", "reason": "Clinical overview of sexuality is not metaresearch."}, {"id": "W2533706679", "categories": [], "domain": null, "study_design": "observational", "genre": "empirical", "about_ca_system": false, "about_ca_topic": false, "confidence": "low", "reason": "Clinical cohort study on medical device impact is not metaresearch."}, {"id": "W2544958871", "categories": [], "domain": null, "study_design": "theoretical_or_conceptual", "genre": "other", "about_ca_system": false, "about_ca_topic": false, "confidence": "low", "reason": "Historical/philosophical analysis of life concepts is not metaresearch."}, {"id": "W2555286646", "categories": [], "domain": null, "study_design": "simulation_or_modeling", "genre": "methods", "about_ca_system": false, "about_ca_topic": false, "confidence": "high", "reason": "Developing a method of inference for disease models is OUT per Rule 1."}, {"id": "W2558376145", "categories": [], "domain": null, "study_design": "qualitative", "genre": "empirical", "about_ca_system": false, "about_ca_topic": false, "confidence": "high", "reason": "Study of teacher contribution to education is not metaresearch."}, {"id": "W2560370233", "categories": ["metaresearch"], "domain": "evaluation", "study_design": "qualitative", "genre": "empirical", "about_ca_system": true, "about_ca_topic": false, "confidence": "high", "reason": "Evaluates the capacity to do and use evaluation in the Ontario public health system."}, {"id": "W2569574764", "categories": [], "domain": null, "study_design": "not_applicable", "genre": "methods", "about_ca_system": false, "about_ca_topic": false, "confidence": "high", "reason": "Software design for real estate visualization is not metaresearch."}, {"id": "W2571097605", "categories": [], "domain": null, "study_design": "meta_analysis", "genre": "empirical", "about_ca_system": false, "about_ca_topic": false, "confidence": "low", "reason": "Pooled clinical trial data on cancer treatment is not metaresearch."}, {"id": "W2589097179", "categories": [], "domain": null, "study_design": "observational", "genre": "empirical", "about_ca_system": false, "about_ca_topic": false, "confidence": "high", "reason": "Psychometric analysis of ADHD symptoms is not metaresearch."}, {"id": "W2589870402", "categories": [], "domain": null, "study_design": "not_applicable", "genre": "review", "about_ca_system": false, "about_ca_topic": false, "confidence": "high", "reason": "Review of MRI methods for neuroanatomy is a domain technique review, not metaresearch."}, {"id": "W2590316147", "categories": [], "domain": null, "study_design": "qualitative", "genre": "empirical", "about_ca_system": false, "about_ca_topic": false, "confidence": "high", "reason": "Study of guideline implementation in nursing is not metaresearch."}, {"id": "W2591567680", "categories": ["metaresearch"], "domain": "methods", "study_design": "observational", "genre": "empirical", "about_ca_system": false, "about_ca_topic": false, "confidence": "high", "reason": "Measures the adoption of evidence-based teaching practices as used by researchers/faculty."}, {"id": "W2594297204", "categories": [], "domain": null, "study_design": "not_applicable", "genre": "empirical", "about_ca_system": false, "about_ca_topic": false, "confidence": "low", "reason": "Knowledge sharing in medical imaging is not metaresearch."}, {"id": "W2596539274", "categories": [], "domain": null, "study_design": "not_applicable", "genre": "other", "about_ca_system": false, "about_ca_topic": false, "confidence": "low", "reason": "Conference record on labor law is not metaresearch."}, {"id": "W2599130616", "categories": [], "domain": null, "study_design": "not_applicable", "genre": "review", "about_ca_system": false, "about_ca_topic": false, "confidence": "high", "reason": "Technical recommendations for redox biochemistry are domain-specific, not metaresearch."}, {"id": "W2603683329", "categories": [], "domain": null, "study_design": "bench_or_experimental", "genre": "methods", "about_ca_system": false, "about_ca_topic": false, "confidence": "high", "reason": "Experimental protocol for tissue preparation is a domain technique, not metaresearch."}, {"id": "W2604214650", "categories": [], "domain": null, "study_design": "systematic_review", "genre": "protocol", "about_ca_system": false, "about_ca_topic": false, "confidence": "high", "reason": "Protocol for a review of social media in education is not metaresearch."}]