[{"id": "W2943459228", "categories": ["sts"], "domain": null, "study_design": "qualitative", "genre": "empirical", "about_ca_system": false, "about_ca_topic": false, "confidence": "high", "reason": "Studies science and research evidence as socially organized knowledge in practice."}, {"id": "W4239293221", "categories": [], "domain": null, "study_design": "theoretical_or_conceptual", "genre": "commentary", "about_ca_system": false, "about_ca_topic": false, "confidence": "high", "reason": "The work does not study science, research, or any defined category."}, {"id": "W3013557364", "categories": [], "domain": null, "study_design": "theoretical_or_conceptual", "genre": "methods", "about_ca_system": false, "about_ca_topic": false, "confidence": "high", "reason": "Developing and explaining a clinical prediction technique is not metaresearch under Rule 1."}, {"id": "W1872548620", "categories": [], "domain": null, "study_design": "theoretical_or_conceptual", "genre": "commentary", "about_ca_system": false, "about_ca_topic": false, "confidence": "high", "reason": "The work concerns feminist social theory rather than a defined study of science or research."}, {"id": "W2730918267", "categories": [], "domain": null, "study_design": "qualitative", "genre": "empirical", "about_ca_system": false, "about_ca_topic": false, "confidence": "high", "reason": "The study examines health practices, not research practices or another defined category."}, {"id": "W2589097179", "categories": [], "domain": null, "study_design": "observational", "genre": "empirical", "about_ca_system": false, "about_ca_topic": false, "confidence": "high", "reason": "The work is an empirical clinical psychometric study outside the defined categories."}, {"id": "W2056984434", "categories": [], "domain": null, "study_design": "observational", "genre": "empirical", "about_ca_system": false, "about_ca_topic": false, "confidence": "high", "reason": "The cohort study concerns family perspectives on clinical care, not a defined category."}, {"id": "W2103936380", "categories": [], "domain": null, "study_design": "systematic_review", "genre": "review", "about_ca_system": false, "about_ca_topic": false, "confidence": "high", "reason": "The review evaluates evidence about medicine advertising rather than research practice itself."}, {"id": "W2799507680", "categories": [], "domain": null, "study_design": "not_applicable", "genre": "other", "about_ca_system": false, "about_ca_topic": false, "confidence": "low", "reason": "The missing abstract prevents reliable screening beyond the title."}, {"id": "W2084126787", "categories": ["metaresearch"], "domain": "methods", "study_design": "bench_or_experimental", "genre": "methods", "about_ca_system": false, "about_ca_topic": false, "confidence": "high", "reason": "The study evaluates alternative research data-collection and modeling methods as used by researchers."}, {"id": "W3197240121", "categories": [], "domain": null, "study_design": "design_other", "genre": "review", "about_ca_system": false, "about_ca_topic": false, "confidence": "high", "reason": "The literature review concerns nursing care for COVID-19 rather than a defined category."}, {"id": "W4391036364", "categories": [], "domain": null, "study_design": "observational", "genre": "protocol", "about_ca_system": false, "about_ca_topic": false, "confidence": "high", "reason": "This is a protocol for a clinical observational cohort study, not a study of research practice."}, {"id": "W2028829563", "categories": [], "domain": null, "study_design": "observational", "genre": "empirical", "about_ca_system": false, "about_ca_topic": false, "confidence": "high", "reason": "The study analyzes primary care encounters and billing-data limitations, not research methods."}, {"id": "W2596539274", "categories": [], "domain": null, "study_design": "not_applicable", "genre": "other", "about_ca_system": false, "about_ca_topic": false, "confidence": "low", "reason": "The missing abstract prevents reliable screening beyond the title."}, {"id": "W2990864246", "categories": [], "domain": null, "study_design": "design_other", "genre": "review", "about_ca_system": false, "about_ca_topic": false, "confidence": "high", "reason": "The clinical concussion update is a medical review outside the defined categories."}, {"id": "W4414617249", "categories": [], "domain": null, "study_design": "observational", "genre": "protocol", "about_ca_system": false, "about_ca_topic": false, "confidence": "high", "reason": "This is a protocol for an observational clinical cohort using microsimulation, not research-on-research."}, {"id": "W4250047758", "categories": [], "domain": null, "study_design": "not_applicable", "genre": "other", "about_ca_system": false, "about_ca_topic": false, "confidence": "high", "reason": "The classification document does not study science or research as an object."}, {"id": "W4413092258", "categories": [], "domain": null, "study_design": "systematic_review", "genre": "protocol", "about_ca_system": false, "about_ca_topic": false, "confidence": "high", "reason": "This is a protocol for a critical interpretive literature synthesis, not a defined category."}, {"id": "W2772752708", "categories": [], "domain": null, "study_design": "design_other", "genre": "empirical", "about_ca_system": false, "about_ca_topic": false, "confidence": "high", "reason": "The case study analyzes financial policy change rather than research or science."}, {"id": "W4390430457", "categories": [], "domain": null, "study_design": "qualitative", "genre": "protocol", "about_ca_system": false, "about_ca_topic": false, "confidence": "high", "reason": "The methodology concerns gender and leadership in higher education, not science as a social practice."}, {"id": "W2896789432", "categories": [], "domain": null, "study_design": "observational", "genre": "empirical", "about_ca_system": false, "about_ca_topic": false, "confidence": "high", "reason": "Applying a capture-recapture model to criminal justice data is a domain technique, excluded by Rule 1."}, {"id": "W2124352716", "categories": ["metaresearch", "sts"], "domain": "methods", "study_design": "qualitative", "genre": "empirical", "about_ca_system": false, "about_ca_topic": false, "confidence": "high", "reason": "The work studies research methodology as social practice and evaluates reflexivity and participation in research."}, {"id": "W3094472893", "categories": [], "domain": null, "study_design": "not_applicable", "genre": "commentary", "about_ca_system": false, "about_ca_topic": false, "confidence": "low", "reason": "The missing abstract leaves only a general science-and-technology news title."}, {"id": "W3197702270", "categories": [], "domain": null, "study_design": "not_applicable", "genre": "other", "about_ca_system": false, "about_ca_topic": false, "confidence": "low", "reason": "The missing abstract prevents reliable study-design and category screening."}, {"id": "W2243728887", "categories": [], "domain": null, "study_design": "simulation_or_modeling", "genre": "empirical", "about_ca_system": false, "about_ca_topic": true, "confidence": "high", "reason": "The work applies a healthcare budget-impact model and does not study research practice."}]