[{"id": "W2142219519", "categories": [], "domain": null, "study_design": "design_other", "genre": "other", "about_ca_system": true, "about_ca_topic": true, "confidence": "low", "reason": "Title only, and the object is post-secondary program funding in Alberta rather than research practice as defined by Ioannidis, so it is in no defined category while the Canadian academy is a substantive object."}, {"id": "W4317381695", "categories": [], "domain": null, "study_design": "design_other", "genre": "other", "about_ca_system": false, "about_ca_topic": false, "confidence": "medium", "reason": "The object is policy evaluation in a school division, not research practice, so it falls in no defined category."}, {"id": "W4405564424", "categories": [], "domain": null, "study_design": "design_other", "genre": "other", "about_ca_system": false, "about_ca_topic": false, "confidence": "low", "reason": "Abstract missing and the title names student self-assessment in teaching, whose object is education rather than research practice."}, {"id": "W3035271094", "categories": [], "domain": null, "study_design": "theoretical_or_conceptual", "genre": "methods", "about_ca_system": false, "about_ca_topic": false, "confidence": "medium", "reason": "Rule 1: describing an evaluation technique for program evaluators is developing a technique for a domain, not studying methods as used by researchers."}, {"id": "W4224314394", "categories": [], "domain": null, "study_design": "systematic_review", "genre": "review", "about_ca_system": false, "about_ca_topic": false, "confidence": "high", "reason": "A systematic review whose claims are about gambling problems and harm minimization, not about studies or research practice, so neither metaresearch nor the Kataoka unit-of-analysis reading applies."}, {"id": "W4367030034", "categories": [], "domain": null, "study_design": "not_applicable", "genre": "commentary", "about_ca_system": false, "about_ca_topic": false, "confidence": "low", "reason": "Abstract missing and the title indicates a judge's viewpoint on a student simulation competition, which is in no defined category."}, {"id": "W2604214650", "categories": [], "domain": null, "study_design": "systematic_review", "genre": "protocol", "about_ca_system": false, "about_ca_topic": false, "confidence": "high", "reason": "Rule 1: a protocol for synthesizing evidence on social media in nursing education is an instance of a research practice, not a study of one."}, {"id": "W4407264846", "categories": [], "domain": null, "study_design": "systematic_review", "genre": "review", "about_ca_system": false, "about_ca_topic": false, "confidence": "high", "reason": "Rule 1: evaluating measurement tools for a substantive domain is technique validation, however generic, and is OUT."}, {"id": "W1983493219", "categories": ["metaresearch"], "domain": "methods", "study_design": "not_applicable", "genre": "commentary", "about_ca_system": false, "about_ca_topic": false, "confidence": "low", "reason": "The object is a genre of comparison studies and the expectation researchers bring to them, which is methods as used by researchers under Rule 1; confidence is low because the abstract is missing."}, {"id": "W4392298597", "categories": [], "domain": null, "study_design": "systematic_review", "genre": "review", "about_ca_system": false, "about_ca_topic": false, "confidence": "medium", "reason": "Rule 1: validating ICD-10 coding accuracy is validation of a technique for a domain, not a study of methods as performed by researchers."}, {"id": "W1570138353", "categories": [], "domain": null, "study_design": "theoretical_or_conceptual", "genre": "review", "about_ca_system": false, "about_ca_topic": false, "confidence": "medium", "reason": "Rule 1: the work appraises and teaches techniques for assessing prognostic accuracy; no researcher behavior is measured."}, {"id": "W4396858531", "categories": [], "domain": null, "study_design": "qualitative", "genre": "empirical", "about_ca_system": false, "about_ca_topic": false, "confidence": "medium", "reason": "A quality improvement project on a nursing student mentorship program; the object is education, not research practice, and the Ontario site is a setting only."}, {"id": "W2324664192", "categories": [], "domain": null, "study_design": "observational", "genre": "empirical", "about_ca_system": false, "about_ca_topic": false, "confidence": "medium", "reason": "Government program evaluation and its institutionalization is not research practice under the Ioannidis definition, and the STS test requires science or technoscientific knowledge as the object."}, {"id": "W4224442502", "categories": [], "domain": null, "study_design": "systematic_review", "genre": "review", "about_ca_system": false, "about_ca_topic": false, "confidence": "high", "reason": "A scoping review of professional identity in rehabilitation clinicians; the object is a profession, not research practice, and the McGill affiliation is a setting only."}, {"id": "W2125820775", "categories": [], "domain": null, "study_design": "systematic_review", "genre": "review", "about_ca_system": false, "about_ca_topic": false, "confidence": "high", "reason": "Rule 1: teaching evidence-based practice to dental students is a technique taught for a domain, not a study of methods as used by researchers."}, {"id": "W4245992123", "categories": ["insufficient_payload"], "domain": null, "study_design": "not_applicable", "genre": "other", "about_ca_system": false, "about_ca_topic": false, "confidence": "high", "reason": "The record is journal paratext titled Issue Information with an empty abstract, so it cannot be screened and is reported rather than dropped."}, {"id": "W2007317588", "categories": [], "domain": null, "study_design": "systematic_review", "genre": "review", "about_ca_system": false, "about_ca_topic": false, "confidence": "high", "reason": "The object is patient education teaching strategies, a substantive clinical topic, so the work is in no defined category."}, {"id": "W1966512523", "categories": [], "domain": null, "study_design": "systematic_review", "genre": "review", "about_ca_system": false, "about_ca_topic": false, "confidence": "medium", "reason": "A health services review of care governance models; its claims concern health systems, not research practice."}, {"id": "W3013869447", "categories": [], "domain": null, "study_design": "systematic_review", "genre": "protocol", "about_ca_system": false, "about_ca_topic": false, "confidence": "high", "reason": "Rule 1: a protocol for a review of weight management technologies is an instance of a research practice, not a study of it."}, {"id": "W2339053550", "categories": [], "domain": null, "study_design": "design_other", "genre": "review", "about_ca_system": false, "about_ca_topic": false, "confidence": "low", "reason": "Abstract missing; the title indicates a review of clinical evaluation instruments for nursing students, which is technique appraisal for a domain under Rule 1."}, {"id": "W237532803", "categories": [], "domain": null, "study_design": "observational", "genre": "empirical", "about_ca_system": false, "about_ca_topic": true, "confidence": "medium", "reason": "Rule 1: validating a workshop feedback questionnaire is technique validation, so the work is in no defined category, though the Canadian Evaluation Society training program in Quebec makes Canada a substantive subject."}, {"id": "W3096487142", "categories": [], "domain": null, "study_design": "design_other", "genre": "commentary", "about_ca_system": false, "about_ca_topic": false, "confidence": "medium", "reason": "A reflective account of a students as partners initiative in an Australian medical curriculum; the object is education, not research practice."}, {"id": "W4412163958", "categories": [], "domain": null, "study_design": "systematic_review", "genre": "protocol", "about_ca_system": false, "about_ca_topic": false, "confidence": "high", "reason": "Rule 1: a protocol for reviewing digital health applications for depression and anxiety is an instance of a research practice, not a study of one."}, {"id": "W2208468041", "categories": [], "domain": null, "study_design": "observational", "genre": "empirical", "about_ca_system": false, "about_ca_topic": false, "confidence": "medium", "reason": "Rule 1: a fidelity check run inside the authors' own trial, plus rating scale reliability, is an instance of a research practice and technique validation, not a study of methods as used by researchers."}, {"id": "W2462945271", "categories": [], "domain": null, "study_design": "not_applicable", "genre": "protocol", "about_ca_system": false, "about_ca_topic": false, "confidence": "low", "reason": "Abstract missing; the title proposes open digital learning activities for health professions education, which is education rather than the accessibility and inclusivity of scientific knowledge production that UNESCO defines as open science."}]