[{"id": "W1995731258", "categories": [], "domain": null, "study_design": "not_applicable", "genre": "review", "about_ca_system": false, "about_ca_topic": false, "confidence": "high", "reason": "Clinical narrative review of long-term outcomes after acute lung injury; object is patient sequelae, not research practices or any defined category."}, {"id": "W1882162740", "categories": [], "domain": null, "study_design": "theoretical_or_conceptual", "genre": "other", "about_ca_system": false, "about_ca_topic": false, "confidence": "high", "reason": "Essay on lifelong learning and universities of the third age; object is senior education, not science, research practice, or scholarly communication."}, {"id": "W2098520295", "categories": [], "domain": null, "study_design": "qualitative", "genre": "empirical", "about_ca_system": false, "about_ca_topic": false, "confidence": "high", "reason": "Cultural studies analysis of advertising and the All Blacks; object is promotional culture, not science, research, or technoscientific knowledge as social practice."}, {"id": "W2803056794", "categories": [], "domain": null, "study_design": "observational", "genre": "empirical", "about_ca_system": false, "about_ca_topic": false, "confidence": "high", "reason": "Health services evaluation of insurance nonquantitative treatment limits under MHPAEA; object is benefit design policy, not research practice."}, {"id": "W4386219672", "categories": [], "domain": null, "study_design": "simulation_or_modeling", "genre": "empirical", "about_ca_system": false, "about_ca_topic": false, "confidence": "high", "reason": "Climate detection-and-attribution fingerprint study of troposphere, surface, and ocean; domain climate science, not metaresearch or related categories."}, {"id": "W3121385036", "categories": [], "domain": null, "study_design": "design_other", "genre": "empirical", "about_ca_system": false, "about_ca_topic": false, "confidence": "low", "reason": "Title alone suggests economic geography; empty abstract and no signal of research-on-research or other defined categories."}, {"id": "W2751482196", "categories": [], "domain": null, "study_design": "qualitative", "genre": "empirical", "about_ca_system": false, "about_ca_topic": false, "confidence": "high", "reason": "International case studies of faculty development for blended learning; object is teaching practice, not research practices as used by researchers."}, {"id": "W3081958277", "categories": [], "domain": null, "study_design": "not_applicable", "genre": "review", "about_ca_system": false, "about_ca_topic": false, "confidence": "high", "reason": "Clinical review of COVID-19 cardiovascular pathophysiology and treatment; Canadian affiliations are setting, not a substantive Canadian research-system or Canada topic object."}, {"id": "W2187046447", "categories": ["metaresearch"], "domain": "methods", "study_design": "theoretical_or_conceptual", "genre": "commentary", "about_ca_system": false, "about_ca_topic": false, "confidence": "high", "reason": "Conceptual critique reconceptualising the EBM evidence base as an unsynthesised matrix for person-centred decisions; object is research methods practice, not technique development for a clinical domain."}, {"id": "W4310555710", "categories": [], "domain": null, "study_design": "not_applicable", "genre": "review", "about_ca_system": false, "about_ca_topic": true, "confidence": "high", "reason": "Gender and leadership in Canadian/Alberta teaching; Canada is a substantive subject, but the education system is not the research system or academy."}, {"id": "W2093030283", "categories": [], "domain": null, "study_design": "observational", "genre": "empirical", "about_ca_system": false, "about_ca_topic": false, "confidence": "high", "reason": "Evaluation of a web tutorial teaching activity analysis to OT students; RULE 1 excludes teaching/validating a domain technique, and McGill is only the setting."}, {"id": "W4380149107", "categories": [], "domain": null, "study_design": "systematic_review", "genre": "review", "about_ca_system": false, "about_ca_topic": false, "confidence": "low", "reason": "Title indicates SR and quality assessment of CVD PROMs; instrument development for clinical outcomes is domain technique work under RULE 1, not research-on-research; empty abstract."}, {"id": "W2890415999", "categories": [], "domain": null, "study_design": "observational", "genre": "empirical", "about_ca_system": false, "about_ca_topic": false, "confidence": "high", "reason": "Undergraduate nursing curriculum review of leadership preparation; object is nursing education, not research practices or integrity."}, {"id": "W2939565443", "categories": [], "domain": null, "study_design": "systematic_review", "genre": "review", "about_ca_system": false, "about_ca_topic": false, "confidence": "low", "reason": "Critical review of 18 agricultural impact studies appears to synthesise crop-impact findings, not methods as research practice; empty abstract limits certainty."}, {"id": "W2591567680", "categories": [], "domain": null, "study_design": "observational", "genre": "empirical", "about_ca_system": false, "about_ca_topic": false, "confidence": "high", "reason": "Inventory of evidence-based undergraduate science teaching practices; object is pedagogy, not research methods, evaluation of science, or STS co-production of knowledge."}, {"id": "W4210342638", "categories": [], "domain": null, "study_design": "theoretical_or_conceptual", "genre": "methods", "about_ca_system": false, "about_ca_topic": false, "confidence": "high", "reason": "Illustration of network meta-analysis for single-case designs is methods development for a domain; RULE 1 excludes developing/deriving a technique from metaresearch."}, {"id": "W3210778493", "categories": [], "domain": null, "study_design": "qualitative", "genre": "other", "about_ca_system": false, "about_ca_topic": false, "confidence": "low", "reason": "Title suggests a nursing interpretive piece on a family navigating cancer; empty abstract and no signal of any defined metascience category."}, {"id": "W3182386410", "categories": [], "domain": null, "study_design": "meta_analysis", "genre": "review", "about_ca_system": false, "about_ca_topic": false, "confidence": "high", "reason": "Clinical systematic review and meta-analysis of COVID-19-related sepsis prevalence; instance of evidence synthesis, not a study of research practices (RULE 1)."}, {"id": "W2325986300", "categories": [], "domain": null, "study_design": "qualitative", "genre": "empirical", "about_ca_system": false, "about_ca_topic": false, "confidence": "high", "reason": "Grounded theory study of student leadership development programs; object is student affairs education, not science or research practice."}, {"id": "W4407162010", "categories": [], "domain": null, "study_design": "observational", "genre": "empirical", "about_ca_system": false, "about_ca_topic": false, "confidence": "high", "reason": "Experimental social psychology of whistleblowing and loyalty motives in organizations generally; object is not research misconduct, QRP, retraction, or publication ethics."}, {"id": "W2115956339", "categories": [], "domain": null, "study_design": "not_applicable", "genre": "editorial", "about_ca_system": false, "about_ca_topic": false, "confidence": "low", "reason": "Very short republished note on diversity in public health; title screens as ordinary public health commentary outside all defined categories."}, {"id": "W2181989282", "categories": [], "domain": null, "study_design": "qualitative", "genre": "empirical", "about_ca_system": false, "about_ca_topic": true, "confidence": "low", "reason": "Title concerns pandemic mitigation in remote First Nations communities (Canada as substantive topic); empty abstract and clinical/public-health object, not research practice."}, {"id": "W1966136889", "categories": [], "domain": null, "study_design": "not_applicable", "genre": "review", "about_ca_system": false, "about_ca_topic": false, "confidence": "high", "reason": "Narrative review of clinical trials of VTE prophylaxis in medical patients; clinical evidence summary, not meta-epidemiology or metaresearch of methods."}, {"id": "W3029769945", "categories": [], "domain": null, "study_design": "design_other", "genre": "empirical", "about_ca_system": false, "about_ca_topic": false, "confidence": "low", "reason": "Title alone concerns influenza vaccination and pandemic influenza; empty abstract and no indication of any defined category."}, {"id": "W4292289507", "categories": [], "domain": null, "study_design": "qualitative", "genre": "empirical", "about_ca_system": false, "about_ca_topic": false, "confidence": "high", "reason": "Qualitative stakeholder study of paramedic roles in Irish general practice; health workforce policy in Ireland, not research practice or Canada."}]